{"protocolVersion":1,"gameKey":"nsr","releaseId":"rel_01j9z3k5w8e2r4t6y8u0i2o4p6","resources":[{"key":"event.weekend","typeKey":"liveops.event.v1","revisionId":"rev_weekend_1","data":{"startAt":"2026-12-05T00:00:00Z","endAt":"2026-12-07T00:00:00Z","payload":{"theme":"weekend"},"artifactRefs":[]}},{"key":"event.winter","typeKey":"liveops.event.v1","revisionId":"rev_winter_1","data":{"startAt":"2026-12-01T00:00:00Z","endAt":"2026-12-08T00:00:00Z","payload":{"theme":"winter"},"artifactRefs":["sha256:b0940a72356dfccd36a77a007ad31ef4709155d5bfa4aef325f229b1700dca2e"]}},{"key":"runtime.config","typeKey":"config.v1","revisionId":"rev_01j9z4a1b2c3d4e5f6g7h8j9k0","data":{"difficulty":{"speed":1.25,"lives":3},"motd":"hello","features":["daily","shop"]}}],"artifacts":[{"digest":"sha256:3598ce6f965b2481fe26316c06b30950c46ac7f8e7229f104aa78f579997668d","mediaType":"image/png","size":1234,"url":"https://runtime.yes2games.com/artifacts/sha256/3598ce6f965b2481fe26316c06b30950c46ac7f8e7229f104aa78f579997668d"},{"digest":"sha256:b0940a72356dfccd36a77a007ad31ef4709155d5bfa4aef325f229b1700dca2e","mediaType":"image/webp","size":2048,"url":"https://runtime.yes2games.com/artifacts/sha256/b0940a72356dfccd36a77a007ad31ef4709155d5bfa4aef325f229b1700dca2e"}]}
