{"protocolVersion":1,"gameKey":"nsr","releaseId":"rel_01j9z3k5w8e2r4t6y8u0i2o4p6","resources":[{"key":"runtime.config","typeKey":"config.v1","revisionId":"rev_01j9z4a1b2c3d4e5f6g7h8j9k0","data":{"difficulty":{"speed":1.25,"lives":3},"motd":"hello","features":["daily","shop"]}}],"artifacts":[{"digest":"sha256:38425dbf0636359f2169562d1a9226332866dddd69b133a712ecf120c06b5bbb","mediaType":"application/vnd.api+json","size":1234,"url":"https://runtime.yes2games.com/artifacts/sha256/38425dbf0636359f2169562d1a9226332866dddd69b133a712ecf120c06b5bbb"},{"digest":"sha256:795ea3efa43d0872b63bf0067be97553b46983e4f075097669391e9d15388ecc","mediaType":"font/woff2","size":1234,"url":"HTTPS://cdn.yes2games.com:8443/f.woff2?v=1#x"},{"digest":"sha256:acdb1373d1761939cb5daa3332223298529581464a90afae39927e7aef8edd46","mediaType":"image/svg+xml","size":1234,"url":"https://runtime.yes2games.com/artifacts/sha256/acdb1373d1761939cb5daa3332223298529581464a90afae39927e7aef8edd46"},{"digest":"sha256:f9194e73f9e9459e3450ea10a179cdf77aafa695beecd3b9344a98d111622243","mediaType":"application/octet-stream","size":0,"url":"https://runtime.yes2games.com/artifacts/sha256/f9194e73f9e9459e3450ea10a179cdf77aafa695beecd3b9344a98d111622243"}]}
