{"protocolVersion":1,"gameKey":"nsr","releaseId":"rel_01j9z3k5w8e2r4t6y8u0i2o4p6","resources":[{"key":"runtime.config","typeKey":"example.future.v9","revisionId":"rev-1","data":[[[[[[[[[[[[[[[[[[[[[[[[[[[[[[[[[[[[[[[[[[[[[[[[[[[[[[[[[[[[[]]]]]]]]]]]]]]]]]]]]]]]]]]]]]]]]]]]]]]]]]]]]]]]]]]]]]]]]]]]]]}],"artifacts":[]}
