{"protocolVersion":1,"gameKey":"nsr","releaseId":"rel_01j9z3k5w8e2r4t6y8u0i2o4p6","resources":[{"key":"runtime.config","typeKey":"config.v1","revisionId":"rev_01j9z4a1b2c3d4e5f6g7h8j9k0","data":{"difficulty":{"speed":1.25,"lives":3},"motd":"hello","features":["daily","shop"]}},{"key":"runtime.future","typeKey":"example.future.v9","revisionId":"rev-future-1","data":{"shape":"anything","nothing":null}}],"artifacts":[{"digest":"sha256:3598ce6f965b2481fe26316c06b30950c46ac7f8e7229f104aa78f579997668d","mediaType":"image/png","size":1234,"url":"https://runtime.yes2games.com/artifacts/sha256/3598ce6f965b2481fe26316c06b30950c46ac7f8e7229f104aa78f579997668d"}]}
