{"protocolVersion":1,"gameKey":"nsr","releaseId":"rel_01j9z3k5w8e2r4t6y8u0i2o4p6","resources":[{"key":"a","typeKey":"config.v1","revisionId":"r0","data":{}},{"key":"a-b","typeKey":"config.v1","revisionId":"r1","data":{}},{"key":"a.b","typeKey":"config.v1","revisionId":"r2","data":{}},{"key":"a0","typeKey":"config.v1","revisionId":"r3","data":{}},{"key":"a_b","typeKey":"config.v1","revisionId":"r4","data":{}},{"key":"ab","typeKey":"config.v1","revisionId":"r5","data":{}},{"key":"b","typeKey":"config.v1","revisionId":"r6","data":{}}],"artifacts":[{"digest":"sha256:3598ce6f965b2481fe26316c06b30950c46ac7f8e7229f104aa78f579997668d","mediaType":"image/png","size":1234,"url":"https://runtime.yes2games.com/artifacts/sha256/3598ce6f965b2481fe26316c06b30950c46ac7f8e7229f104aa78f579997668d"}]}
