{"protocolVersion":1,"gameKey":"nsr","releaseId":"rel_01j9z3k5w8e2r4t6y8u0i2o4p6","resources":[{"key":"future.a","typeKey":"config.v2","revisionId":"r1","data":null},{"key":"future.b","typeKey":"example.list.v1","revisionId":"r2","data":[1,"two",null]},{"key":"future.c","typeKey":"example.text.v1","revisionId":"r3","data":"plain"},{"key":"future.d","typeKey":"example.number.v1","revisionId":"r4","data":1e+300},{"key":"future.e","typeKey":"example.flag.v1","revisionId":"r5","data":false}],"artifacts":[{"digest":"sha256:3598ce6f965b2481fe26316c06b30950c46ac7f8e7229f104aa78f579997668d","mediaType":"image/png","size":1234,"url":"https://runtime.yes2games.com/artifacts/sha256/3598ce6f965b2481fe26316c06b30950c46ac7f8e7229f104aa78f579997668d"}]}
