{"protocolVersion":1,"gameKey":"nsr","releaseId":"rel_01j9z3k5w8e2r4t6y8u0i2o4p6","resources":[{"key":"k","typeKey":"t","revisionId":"r","data":{}}],"artifacts":[{"digest":"sha256:3598ce6f965b2481fe26316c06b30950c46ac7f8e7229f104aa78f579997668d","mediaType":"image/png","size":1234,"url":"https://runtime.yes2games.com/artifacts/sha256/3598ce6f965b2481fe26316c06b30950c46ac7f8e7229f104aa78f579997668d"}]}
